{
  "schema_version": "1.0.0",
  "project": { "project_id": "proj_sj_007", "capture_source": "polycam", "units": "imperial" },
  "floors": [{ "floor_id": "flr_main", "label": "main", "origin": {"x_in":0,"y_in":0}, "extent": {"width_in":480,"height_in":360} }],
  "entities": {
    "walls": [],
    "openings": [],
    "rooms": []
  },
  "revisions": [{ "rev_id": "rev_seed", "timestamp": "2026-05-24T19:14:00Z", "actor": "system", "source": "intake", "operations": [], "model_hash": "seedhash005" }],
  "validation": {
    "status": "invalid",
    "errors": [{ "code": "E-PARSE-002", "message": "Low confidence extraction", "severity": "blocking" }],
    "warnings": [{ "code": "W-PARSE-001", "message": "No room regions inferred" }],
    "parser_confidence": 0.41
  }
}
